HUM:ind,What baseball player was walked the most times ?,31
HUM:ind,What famous male vocalist has the same name as the composer of the opera Hansel and Gretel ?,31
ENTY:food,What were the first frozen foods ?,14
DESC:reason,Why is Indiglo called Indiglo ?,6
ENTY:word,What is the word for love of pain or abuse ?,28
NUM:date,When did they canonize the Bible ?,40
HUM:ind,Who was the only president to serve two nonconsecutive terms ?,31
NUM:perc,What percentage of all world tornados touch down in the US ?,45
HUM:ind,What labor leader was last seen in the parking lot of a Michigan restaurant ?,31
NUM:date,When did the Carolingian period begin ?,40
DESC:desc,What motto ended Merrie Melodies cartoons ?,4
HUM:ind,Who reports the weather on the `` Good Morning America '' television show ?,31
NUM:count,How many emperors were there in the Roman Empire ?,39
HUM:ind,What was the name of `` The Muppets '' creator ?,31
DESC:def,What is Cabarnet Sauvignon ?,3
DESC:def,What is a virtual IP address ?,3
ENTY:animal,What 's the name of the tiger that advertises for Frosted Flakes cereal ?,7
HUM:ind,Who sent the brief message `` I came  I saw  I conquered '' ?,31
ENTY:color,What color is Mr. Spock 's blood ?,9
HUM:ind,What U.S. Air Force general led the first bombing raid over Tokyo ?,31
HUM:ind,What U.S. vice-president said : `` Some newspapers dispose of their garbage by printing it '' ?,31
HUM:ind,What was the name of the first Watergate special prosecutor  later fired by Nixon ?,31
DESC:manner,How do movie blues screens work ?,5
DESC:manner,How does the speed the magnet spins in a generator affect the output of the generator ?,5
HUM:gr,What 's the supreme policy-making bureau of the Soviet Communist Party ?,30
DESC:def,What was the Vietnam War ?,3
DESC:def,What is La Nina ?,3
DESC:reason,Why did the Globe Theatre burn down ?,6
NUM:date,On what day were John F and Jackie Kennedy married ?,40
ENTY:cremat,What was the non-fiction best-seller of 1952  1953 and 1954 ?,10
DESC:def,What is meant by blood SED rate ?,3
HUM:gr,Who are the nomadic hunting and gathering tribe of the Kalahari Desert in Africa ?,30
HUM:ind,Who won a Pulitzer Prize for his novel The Caine Mutiny ?,31
ENTY:techmeth,What 's the best way to lose the flab under your chin and around your face ?,25
LOC:other,Where is your corpus callosum ?,36
ENTY:cremat,What Broadway musical featured the song  `` If I were a rich man ? '',10
HUM:ind,Who portrayed Sherlock Holmes in 14 films between 1939 and 1946 ?,31
DESC:reason,Why is the development of space so important ?,6
DESC:desc,What is the nursery rhyme Rock-a-by Baby about ?,4
LOC:other,When Superman needs to get away from it all  where does he go ?,36
NUM:period,How old is singer Freedy Johnston ?,46
DESC:desc,What is the origin of gametophytic tissue ?,4
DESC:def,What does Aaron mean ?,3
ENTY:dismed,What is a fear of hair ?,12
HUM:ind,What is the name of the pop singer whose song became the theme song for a brand of catsup ?,31
DESC:def,What is a conifer ?,3
HUM:ind,Who claimed to be the world 's most perfectly-developed man ?,31
DESC:desc,What is different about the red and black fox ?,4
DESC:def,What is e-commerce ?,3
DESC:manner,How do I tie a tie ?,5
LOC:other,Where can I get cotton textiles importer details ?,36
NUM:date,When did Spain and Korea start ambassadorial relations ?,40
HUM:gr,What kind of people took part in Shays ' Rebellion in Massachusetts in 1787 ?,30
DESC:def,What is chromatology ?,3
NUM:count,How many grooves are on a dime 's edge ?,39
DESC:manner,How was the ACLU formed ?,5
ENTY:cremat,What are the most albums sold by one artist or band ?,10
ENTY:sport,The second most popular sport worldwide is what ?,22
ENTY:other,What do goldfish lose if kept in dimly-lit or running water ?,18
LOC:other,What canal does the Thatcher Ferry Bridge span ?,36
HUM:ind,What American won the world Grand Prix driving championship in 1978 ?,31
NUM:perc,What are the chances of pregnacy if the penis does not penetrate the vagina ?,45
ENTY:other,What 's the highest hand in straight poker ?,18
LOC:other,Where can I find a lesson plan for teaching the metric system conversion to American standard ?,36
ENTY:cremat,What is the name of Kevin Costner 's movie about Sioux Indians ?,10
DESC:def,What are Kythnos  Siphnos  Seriphos and Mykonos ?,3
HUM:ind,Name a female figure skater .,31
DESC:reason,Why are there no white lines on pro footballs ?,6
NUM:period,How long would it take for a $ savings bond to mature ?,46
DESC:manner,How is Abigail Arcane related to the villainous opponent of the Swamp Thing ?,5
ENTY:other,What did the Congress of Vienna establish ?,18
NUM:money,What is the average cost for four years of medical school ?,42
ENTY:substance,What harmful chemicals are in bug spray ?,23
NUM:count,How many spears are there on Kenya 's flag ?,39
DESC:desc,What did Mighty Mouse always sing as he went into action ?,4
LOC:other,Where did George of the Jungle live ?,36
DESC:manner,How did Bob Marley die ?,5
NUM:other,What 's men 's par on a 455-yard golf hole ?,44
NUM:perc,What percentage of American men are alcoholic ?,45
NUM:money,Dialing 900 740-TREE to have a tree planted will cost how much ?,42
NUM:count,In South Korea  how many American Soldiers are there ?,39
HUM:ind,Who portrayed Carl Bernstein in All the President 's Men ?,31
NUM:other,What are the numbers that fit into Fermont 's last theorem ?,44
HUM:ind,Who was Tiny Tim 's father ?,31
ENTY:other,What does a heliologist study ?,18
HUM:ind,Who was Bonnie Blue Butler 's father ?,31
ENTY:product,What shampoo prevents eczema  seborrhea  and psoriasis ?,20
NUM:count,How many Americans have HIV ?,39
LOC:other,Where do I find information for foreclosure properties on the Internet ?,36
HUM:ind,Who is the Antichrist ?,31
ENTY:cremat,What was the first English play written exclusively for children ?,10
LOC:country,Which Latin American country is the largest ?,34
LOC:other,What was the former residence of Scottish kings in Edinburgh ?,36
NUM:count,How many teats does a female goat sport ?,39
NUM:dist,How tall is kilamanjaro ?,41
HUM:ind,Who was the lawyer who represented Randy Steven Craft ?,31
LOC:country,What country buys 25 percent of the world 's tea exports ?,34
LOC:country,What country is the origin of the band the Creeps ?,34
ENTY:other,What did the crocodile swallow in Peter Pan ?,18
DESC:desc,What is the origin of the word `` mushroom '' ?,4
HUM:ind,Which of the following celebrities was not born in Philadelphia ?,31
NUM:other,What is the number of American soldiers deployed to South Korea ?,44
LOC:other,Where is the biggest bell ?,36
ENTY:product,What is the brand name of the chemical daminozide ?,20
DESC:manner,How do microwaves work ?,5
ENTY:cremat,What magazine paid Ernest Hemingway $15 a word to write a bullfighting article ?,10
NUM:count,What is the estimated total U.S. whitetail deer population ?,39
HUM:ind,Who wrote the Farmer 's Almanac ?,31
ENTY:animal,What animal received royal assent as an emblem of Canada on March 24  1975 ?,7
NUM:other,What number is at 12 o 'clock on a dartboard ?,44
HUM:gr,Which team won the Super Bowl in 1968 ?,30
DESC:desc,What is the recommended daily requirement for folic acid for pregnant women ?,4
ENTY:cremat,What film dramatized the Scopes monkey trial ?,10
HUM:ind,CNN is owned by whom ?,31
LOC:country,What country offered Albert Einstein its presidency in 1952 ?,34
DESC:def,What is the HIGHEST Roman numeral ?,3
ENTY:cremat,What TV series saw many of its aquatic scenes shot at Silver Springs  Florida ?,10
HUM:ind,Who was the 15th century fire-and-brimstone monk who gained control of Florence but ended burnt at the stake ?,31
DESC:manner,How is digital audio used ?,5
ABBR:exp,What is AFS ?,2
HUM:desc,Who was Quetzalcoatl ?,29
ENTY:product,What operating system do IBM-compatible machines use ?,20
HUM:ind,What French leader sold Louisiana to the United States ?,31
LOC:other,What bay sparkles next to Miami  Florida ?,36
NUM:count,How many miles of veins are in the circulatory system ?,39
LOC:other,What famed river flows through Bagdad ?,36
DESC:manner,How is bubble wrap made ?,5
DESC:def,What is Java ?,3
HUM:ind,Who is the prime minister of Japan ?,31
HUM:ind,What player squats an average of 3 times during a baseball doubleheader ?,31
HUM:ind,What 's the most common name in nursery rhymes ?,31
NUM:count,How many `` No '' answers was the What 's My Line ? panel allowed ?,39
NUM:money,What is the fine for having a dog on a beach ?,42
HUM:ind,Who wrote the book  `` Song of Solomon '' ?,31
LOC:other,Where can one find information on religion and health  the brain and nutrition ?,36
HUM:ind,Name the Ranger who was always after Yogi Bear .,31
ENTY:cremat,What TV show did John Sebastian sing the theme for ?,10
HUM:ind,Who is the president of the Spanish government ?,31
HUM:ind,Who holds the career record for the most major league home runs ?,31
HUM:ind,Which of the following actors worked in New York 's Yiddish Theater ?,31
HUM:ind,Who invented the stethoscope ?,31
DESC:def,What is a mathematical factor ?,3
NUM:count,How many four star generals were there and who are they ?,39
NUM:date,When did Nixon die ?,40
ENTY:termeq,What was originally defined as one 1-millionth of the distance from the equator to the Pole ?,26
HUM:ind,What comedian hit the TV screen in 1951 with the NBC afternoon show Time for Ernie ?,31
NUM:count,How many members are in the California congressional delegation ?,39
LOC:other,What erupts every hour at Yellowstone National Park ?,36
LOC:country,What country contains the highest point in South America ?,34
HUM:ind,What are Arnold Palmer 's fans called ?,31
HUM:ind,Who retired with 755 home runs to his credit ?,31
LOC:other,What constellation represents a hunter with club and shield ?,36
HUM:ind,Who developed potlatch ?,31
NUM:period,How long did Shea and Gould practice law in Los Angeles ?,46
NUM:other,What 's a perfect score in a gymnastics exercise ?,44
HUM:gr,What group included Abbey Hoffman  Jerry Rubin  and Tom Hayden ?,30
DESC:reason,What made Jane Goodall famous ?,6
NUM:period,At what age did Rossini stop writing opera ?,46
LOC:city,What Russian seaport has a name meaning `` Lord of the East '' ?,33
HUM:ind,Name the two actress daughters of John Mills .,31
NUM:period,How old was Gene Siskel ?,46
DESC:desc,What can be done about snoring ?,4
LOC:mount,What Rocky Mountain ridge separates North America 's eastward and westward-flowing rivers ?,35
HUM:ind,Who is the actress Bette Davis once said she wished she looked like ?,31
HUM:ind,Who portrayed The Cowardly Lion in The Wizard of Oz ?,31
ENTY:dismed,What does a chiropodist treat ?,12
DESC:def,What is porphyria ?,3
LOC:other,What gate opened on East and West Berlin ?,36
HUM:ind,Who was the first king of England ?,31
DESC:reason,What made the Finger Lakes in western New York state ?,6
ENTY:cremat,In what movie is the number nine found in the title ?,10
NUM:count,How many calories are there in soy sauce ?,39
HUM:ind,Who killed Kurt Cobain ?,31
HUM:ind,Who created the monster in Mary Shelley 's novel Frankenstein ?,31
LOC:other,What 's the farthest planet from the sun ?,36
DESC:reason,Why does the sun shine only a short time in Alaska ?,6
ENTY:dismed,What chemical in red wine is good for the heart and what exactly does it do to your body ?,12
DESC:manner,How does blood clot ?,5
NUM:volsize,How big is our galaxy in diameter ?,49
ENTY:product,What product `` doubles your pleasure  doubles your fun '' ?,20
NUM:date,When is a woman most fertile ?,40
HUM:ind,What son of a 15-year-old Mexican girl and a half-Irish father became the world 's most famous Greek ?,31
HUM:ind,Who was the first man to return to space ?,31
ENTY:product,What brand of jeans did Calvin Klein admit in a 1984 interview he felt more comfortable wearing ?,20
HUM:ind,Who gave Abbie Hoffman his first dose of LSD ?,31
DESC:desc,What effect does friction have on perpetual motion ?,4
HUM:title,What did the Seven Dwarfs do for a living ?,32
HUM:ind,What 4-foot-9 actress in 1984 became the first performer to win an Oscar for playing a character of the opposite sex ?,31
HUM:ind,Who shot Billy the Kid ?,31
DESC:desc,What is he doing now ?,4
HUM:ind,What Mormon leader was said to have had 27 wives ?,31
ENTY:other,What video format was an alternative to VHS ?,18
DESC:desc,Where did the term `` 69 '' come from ?,4
ENTY:substance,What is money made of ?,23
LOC:other,What 's the name of a hotel in Indianapolis ?,36
NUM:count,How many people in Tucson ?,39
LOC:other,Where is Melbourne ?,36
HUM:ind,With whom did Bush compare Saddam Hussein ?,31
LOC:country,What country was Mikhail Gorbachev the leader of ?,34
NUM:weight,What is the recommended weight of a 15 year-old male that is 5  6 ?,0
HUM:ind,What pillar of the Dutch Renaissance painted Aristotle Contemplating the Bust of Homer ?,31
LOC:other,What is the largest county in size in Massachusetts ?,36
HUM:ind,What is the name of the brilliant British economist behind its creation ?,31
HUM:ind,Who played Sally Rogers on The Dick Van Dyke Show ?,31
DESC:desc,What is it like to experience a near death episode ?,4
HUM:ind,What mythical figure carries an hourglass and a scythe ?,31
NUM:money,How much is a Canadian 1967 twenty dollar gold coin worth ?,42
DESC:reason,Why didn 't European colonial rule spread until after the first and second industrial revolutions ?,6
LOC:other,What natural attractions draw the most visitors in the United States ?,36
HUM:gr,What presidential administration challenged Americans to explore The New Frontier ?,30
NUM:count,How many years did Sleeping Beauty sleep ?,39
NUM:period,How long does it take for your body to restore blood after you donate your blood ?,46
DESC:manner,How do I know someone is truly in love with me ?,5
ENTY:food,Which of many numbered vats of Scotch was judged best by a panel of experts in 1863 ?,14
DESC:def,What is literary criticism ?,3
DESC:manner,How do you throw a housewarming party ?,5
ENTY:sport,What international sport was originally called hurley ?,22
LOC:other,What river runs through Liverpool ?,36
HUM:ind,What famous British actor lost his voice after an operation in 1966 ?,31
DESC:def,What does the term 3 mean to a newspaper editor ?,3
HUM:gr,What company makes impulse hardening equipment ?,30
LOC:country,What country was Kim Philby really working for ?,34
DESC:desc,What does Freddy Freeman say to become Captain Marvel Jr. ?,4
LOC:country,What country was Hitler the chancellor of ?,34
HUM:ind,What is Rona Barrett 's married name ?,31
NUM:count,How many years make up a lustrum ?,39
ENTY:other,What are close encounters of the first and second kind ?,18
HUM:ind,Who is the mathematician that won the Noble Prize for Literature in 1950 ?,31
HUM:ind,Which glamorous actress is a close friend of Dick Tracy ?,31
ENTY:cremat,What 1956 Grace Metalious novel was on the best-seller list for two years ?,10
HUM:gr,Name the three races unleashed by the Celestials in Marvel comics .,30
NUM:period,How old is the Italian artist Maurizio Pellegrin ?,46
HUM:ind,What President hit the jogging paths to enhance his athletic image and  sporting No. 39  almost collapsed during the road race ?,31
DESC:desc,What is the distinction of Erle Stanley Gardner 's The Case of the Terrified Typist ?,4
LOC:city,What North American city would you visit to see Cleopatra 's Needle ?,33
NUM:date,When was the NFL established ?,40
LOC:other,Where can I find an Ask An Expert site ?,36
HUM:ind,What writer-journalist made his mark describing colorful Broadway and underworld characters ?,31
LOC:state,What U.S. state has the lowest highest elevation at 6 feet ?,37
HUM:gr,What are the residents of the island of Lesbos called ?,30
ENTY:other,What is the organizational structure of the New Delhi Indira Gandhi airport ?,18
ENTY:other,At Christmas time  what is the traditional thing to do under the mistletoe ?,18
HUM:ind,What baseball great plugged Mr. Coffee ?,31
ENTY:sport,What international amateur sports spectacle was first telecast in 1956 ?,22
DESC:desc,What is the origin of the word `` amen '' ?,4
HUM:ind,Who 's baby was Sweet Pea on the Popeye cartoon ?,31
LOC:other,Where is Mile High Stadium ?,36
ENTY:other,What were Baffin  Frobisher and Franklin looking for ?,18
DESC:def,What is limbo ?,3
LOC:city,What city contains the district of Hell 's Kitchen ?,33
ENTY:techmeth,What interesting method was used to run the credits in the early Popeye cartoons ?,25
ENTY:substance,What are the stars made of ?,23
HUM:ind,What English physician was born on January 18  1779 and went on to create two important inventions ?,31
HUM:ind,Who did Arthur H. Bremer try to assassinate on May 15  1972 ?,31
NUM:speed,How fast must a spacecraft travel to escape Earth 's gravity ?,47
HUM:ind,What apostle is Taylor Caldwell 's Great Lion of God ?,31
NUM:count,How many rings are there on a five-zone archery target ?,39
ENTY:dismed,What anesthetic did Queen Victoria allow to be used for the birth of her seventh child  in 1853 ?,12
ENTY:substance,What element  from the Periodic Table  is a gas or a solid  but never a liquid ?,23
DESC:def,What is a tonne ?,3
LOC:other,Which one of the Great Lakes is entirely within U.S. territory ?,36
ABBR:exp,What is DEET ?,2
HUM:gr,What company sells the most greeting cards ?,30
LOC:state,What U.S. state has sagebrush as its state flower ?,37
DESC:def,What is the Bernoulli Principle ?,3
HUM:ind,What 's comic strip photographer Peter Parker 's secret identity ?,31
DESC:desc,What is difference between a poster and a print ?,4
ENTY:sport,In which sport is there a `` scrum '' ?,22
ENTY:techmeth,What are the best ways to improve employee morale at low cost ?,25
LOC:country,What nationality is Pope John Paul II ?,34
DESC:def,What is false consciousness ?,3
DESC:manner,How did the Great Depression affect Japan 's history ?,5
ENTY:other,Which side should a bowler facing a 37803 split hit the 3-pin on-the left or the right ?,18
LOC:other,Where are some great educational resources for parents and teachers ?,36
NUM:count,How many Israeli athletes were killed at the Munich Olympics ?,39
ENTY:termeq,What is the Scotch `` for people who know the difference '' ?,26
NUM:date,When was Richard Nixon born ?,40
LOC:other,What New York City landmark has 168 steps to its crown ?,36
LOC:other,Where is the Bulls basketball team based ?,36
NUM:period,What is the recomended age to switch a child from a crib to a bed ?,46
HUM:ind,Which Rockefeller was sometimes called `` JDR3 '' ?,31
NUM:date,When is the Sun closest to the Earth ?,40
DESC:desc,What are some chemical properties of mendelevium ?,4
NUM:count,What is the average hours per months spent online by AOL users ?,39
HUM:ind,Whom did Friz Freleng add to the Warner Bros. cartoon ranks ?,31
DESC:desc,What is the origin of the word `` sideburns '' ?,4
ENTY:event,The trials resulting from World War II are known as what ?,13
ENTY:event,What started in 1849 when gold was discovered at Sutter 's Mill ?,13
DESC:def,What is a First World country ?,3
HUM:ind,Who was Shakespeare 's Moorish general ?,31
LOC:mount,What 's the second-highest mountain in the world ?,35
LOC:country,What country was Erich Honecker the leader of ?,34
DESC:manner,How does salt melt ice and snow ?,5
LOC:city,What two Japanese cities are spelled with the letters K  O  O  T and Y ?,33
DESC:def,What does laser stand for ?,3
HUM:ind,Who taught Matt Murdock to use his extraordinary abilities in Marvel comics ?,31
LOC:other,Where did Wile E. Coyote always get his devices ?,36
NUM:dist,How far away is the moon ?,41
HUM:ind,What famous film and TV cowboy lent his name to a fast food chain ?,31
DESC:def,What is mandibulofacial dysostosis ?,3
DESC:reason,What was the reason for the partition of the Anglican and Vatican churches ?,6
DESC:def,What is Butterfield 8 in Butterfield 8 ?,3
HUM:ind,Who famously rode to warn the people of Massachusetts that the British were coming ?,31
ABBR:exp,What is DTMF ?,2
ENTY:cremat,Name a movie that the actress  Sandra Bullock  had a role in .,10
ENTY:other,What blew up at Lakehurst  New Jersey  on May 6  1977 ?,18
HUM:ind,Who commanded the French forces at the Battle of Orleans ?,31
LOC:other,Where can an individual get a contact lens tested that burned the entire surface of eye when new ?,36
LOC:country,What countries does the Mont Blanc Tunnel join ?,34
ENTY:veh,What ill-fated craft was captained by Ernst Lehmann ?,27
NUM:date,When did Amtrak begin operations ?,40
NUM:count,How many bones are in the human hand ?,39
NUM:count,How many chemical elements are there ?,39
LOC:state,What eastern state sprouted the first commercial nuclear power plant in the U.S. ?,37
LOC:country,What are the three most populated countries in the world ?,34
HUM:ind,Who led the opposition when Konrad Adenauer was Chancellor in Germany ?,31
NUM:count,What is the current population for these countries : France  Spain  Italy  Greece  Austria  Germany  Switzerland  the Netherlands ?,39
NUM:period,What is the youngest age a boy or girl can have an orgasm ?,46
ENTY:color,What color is the lipstick on Boy George 's wax lips at London 's Madame Tussaud 's ?,9
DESC:desc,What is the origin of the candy cane at Christmas ?,4
ENTY:product,What is the brand name of a chemical used to control ripening ?,20
ENTY:animal,What terror of the sea did Johnny Horton sing about ?,7
LOC:other,What is the largest office block in the world ?,36
HUM:ind,Who turned all he touched to gold ?,31
ENTY:dismed,What is the medical term for cancer of the blood ?,12
HUM:ind,Who plays shortstop for Charlie Brown 's baseball team ?,31
LOC:country,What country did the Romans call Hibernia ?,34
HUM:ind,Who was the most famous food editor of The New York Times ?,31
NUM:count,How many dogs pull a sled in the Iditarod ?,39
ENTY:termeq,What 's a male witch called ?,26
NUM:period,How long does cocaine stay in your system ?,46
LOC:country,What two countries fought the Hundred Years ' War ?,34
HUM:ind,Who was the last U.S. president to reinstate Selective Service registration ?,31
NUM:date,On which dates does the running of the bulls occur in Pamplona  Spain ?,40
HUM:ind,What was the name of the lawyer who represented Randy Steven Craft ?,31
DESC:desc,What happens to used motor oil ?,4
ENTY:word,What is the most commonly used 1 letter word in the English language ?,28
HUM:ind,What actress 's autobiography is titled Shelley : Also Known as Shirley ?,31
NUM:count,How many colors was the 1940s collectible called a Donald Duck Rubber Boat ?,39
DESC:manner,How did the 7th inning stretch get started ?,5
HUM:ind,Who lived on the shores of the Gitchee Gumee River ?,31
ENTY:other,What did Tristan come back as ?,18
LOC:country,What country will hit the year 2 first ?,34
ENTY:color,What colors make up a rainbow ?,9
ENTY:event,What war did Johnny Reb and Billy Yank fight ?,13
HUM:ind,Who is section manager for guidance and control systems at JPL ?,31
HUM:ind,What is Goldfinger 's first name ?,31
LOC:other,What square is the geographical center of London ?,36
HUM:ind,Which of the following famous people does not paint as a hobby ?,31
LOC:city,What is the most populated city in the world ?,33
NUM:count,How many pitchers occupy the shelf beside the crouching woman in Edgar Degas 's 1886 painting The Tub ?,39
NUM:money,What is the cost of the drugs used in tuberculosis treatments ?,42
ABBR:exp,What does JESSICA mean ?,2
ENTY:event,What famed gangland slaughter cut into the membership of Bugs Moran 's outfit ?,13
ENTY:instru,Ray Charles is best known for playing what instrument ?,15
LOC:other,Where did Victor Hugo spend his exile ?,36
DESC:desc,What was Nine Tailors  the television show from 1974  about ?,4
DESC:manner,How does the Elongated Man know a mystery is afoot ?,5
ENTY:food,What food of the three bears did Goldilocks eat ?,14
DESC:def,What is Boston Kreme ?,3
HUM:ind,Who should I call to get a tour of the New York Stock Exchange ?,31
NUM:count,How many airline schools are there in the U.S. ?,39
HUM:ind,What U.S. general died December 1 1945 when his jeep collided with a truck ?,31
DESC:def,What is a swatch ?,3
DESC:def,What does Ouija mean ?,3
NUM:count,How many major Nazi leaders went on trial after the war at Nuremberg ?,39
ENTY:animal,What kind of fish is a coney ?,7
LOC:state,What state did Helen Keller call home ?,37
HUM:ind,What was the name of the director of the movie `` Jaws '' ?,31
DESC:desc,What steps can be taken to prevent diabetes ?,4
DESC:desc,What were the first words spoken on a film sound track ?,4
NUM:date,What year is etched on the Gold Medal of Excellence from the Paris Exposition depicted on a can of Campbell 's tomato soup ?,40
LOC:country,What country 's royal house is Bourbon-Parma ?,34
ENTY:cremat,What film was Jude Law in ?,10
HUM:ind,Who portrayed W.C. Fields in the film W.C. Fields and Me ?,31
ENTY:other,What were the ceremony traditions like during the Elizabethian times ?,18
HUM:gr,Which college did Dikembe Mutombo play basketball at ?,30
ENTY:dismed,What is a fear of going to bed ?,12
DESC:desc,Where did the saying `` rule of thumb '' come from ?,4
DESC:reason,Why does sound travel quicker through water than air ?,6
NUM:money,How much money does the Sultan of Brunei have ?,42
LOC:country,What country would you visit to ski in the Dolomites ?,34
NUM:date,What month 's third weekend is the Monterey Jazz Festival held on ?,40
DESC:def,What is the `` Global Economy '' ?,3
HUM:ind,Who built the first successful stern wheel steamboat ?,31
DESC:def,What is a caul ?,3
HUM:ind,Who was Hitler 's minister of propaganda ?,31
HUM:ind,Who was the first doctor to successfully transplant a liver ?,31
DESC:def,What does the theory of quantum leaps mean in simpler terms ?,3
DESC:def,What is a bone marrow transplant ?,3
DESC:desc,What is the difference between a classical and an acoustic guitar ?,4
LOC:city,What African capital is named for a U.S. president ?,33
ENTY:lang,What is the name of a language spoken by the Sioux ?,16
