ENTY:veh,What Nantucket shipwreck killed more divers exploring it than the 52 people it sank with ?,27
ENTY:animal,What are the two largest birds on earth ?,7
ENTY:cremat,Name the four stories contained in Edith Wharton 's `` Old New York . '',10
LOC:other,What is the largest lake in North America ?,36
NUM:count,How many people died because of a smoking problem in 1997 ?,39
ENTY:dismed,What is chronic constipation a symptom of ?,12
HUM:ind,Who wrote The Look of Love after viewing Ursula Andress ?,31
HUM:ind,What is the name of the American swimmer who won seven gold medals in the 1972 Olympics ?,31
HUM:ind,Who claims to have the greatest show on earth ?,31
DESC:def,What is Head Start ?,3
HUM:ind,What Honeymooners actress did Television magazine name as 1953 's most promising star ?,31
DESC:reason,Why can 't women serve in the Navy on board submarines ?,6
ENTY:other,What did the Yalta Conference lead to ?,18
ENTY:animal,What dog was dubbed The Mortgage Lifter ?,7
DESC:def,What is saltpeter ?,3
DESC:desc,What 's the difference between J.D. and LL.M. ?,4
HUM:gr,What kind of organization is ` Last Chance for Animals ' ?,30
HUM:ind,What was the role of the Medieval Guild ?,31
HUM:ind,Silly putty was invented by whom ?,31
ENTY:other,What should the oven be set at for baking Peachy Oat Muffins ?,18
DESC:manner,How can someone become a federal agent ?,5
HUM:ind,Who invented the paper clip ?,31
HUM:ind,Whom did Lauren Bacall marry after her husband Humphrey Bogart died ?,31
NUM:count,How many times in his 16-year National Basketball Associaton career was John Havlicek a member of the all-star team ?,39
LOC:city,What city or state do the most gay men live in ?,33
NUM:period,Shea and Gould had an office in Los Angeles for how long before closing it ?,46
ENTY:word,What word occurs 46  227 times in the Bible ?,28
DESC:manner,How can you be happy ?,5
DESC:manner,How would someone go about becoming an organ donor ?,5
NUM:date,What year did Degas create the bronze sculpture  `` Fourth Position Front ? '',40
HUM:ind,What composer was awarded the Medal of Honor by Franklin D. Roosevelt ?,31
NUM:count,How many URL extensions are there ? and what are they ?,39
NUM:period,How long after intercourse does it take to find out if you are pregnant ?,46
ABBR:exp,What does U.S.S.R. stand for ?,2
HUM:ind,Who created the Fantastic Four  Hulk  and Thor ?,31
ENTY:dismed,What is a fear of gravity ?,12
HUM:ind,Who is the composer of `` Canon in D Major '' ?,31
DESC:desc,What did n't Rocky Marciano do in his pro boxing career ?,4
LOC:other,Where are all European and American eels born ?,36
HUM:ind,Who was the author of the novel `` Far From the Madding Crowd '' ?,31
DESC:def,What is the definition of ` graphic details ' ?,3
ENTY:product,What was `` America 's recessed-filter cigarette '' ?,20
ENTY:animal,What kind of dog is Scooby Doo ?,7
DESC:reason,What is the function of the appendix ?,6
HUM:ind,What department store heir is responsible for raising a three-ton safe from the underwater wreckage of the Andrea Doria ?,31
ENTY:other,Which sex is twice as likely to contract leprosy ?,18
LOC:city,What was the first town to be chartered in Vermont ?,33
LOC:state,What state has the longest Great Lakes shoreline ?,37
LOC:state,What U.S. state ends with a G ?,37
NUM:count,How many varieties of twins are there ?,39
DESC:def,What is a Cartesian Diver ?,3
LOC:other,What are the largest libraries in the US ?,36
NUM:count,How many people live in the Falklands ?,39
HUM:ind,Who was Camp David named for ?,31
ENTY:cremat,What document did President Andrew Johnson want a copy of placed under his head upon his burial ?,10
HUM:ind,Who portrayed `` the man without a face '' in the movie of the same name ?,31
DESC:desc,What happened in dogtown in 1899 to make that year remembered ?,4
ENTY:other,What wheel did Blaise Pascal invent in a search for perpetual motion ?,18
NUM:money,How much money was the minimum wage in 1991 ?,42
NUM:date,In what year was the first patent for the pull-tab opener on cans obtained ?,40
LOC:country,What country boasts the most dams ?,34
NUM:money,What is the regular price ?,42
LOC:other,What Metropolis landmark was first introduced in the Superman cartoons of the 1940 's ?,36
LOC:other,Where can one find Mozambique ?,36
DESC:manner,How do you recognize anorexia ?,5
ENTY:cremat,What Mary Tyler Moore Show regular came into the world as Tadeus Wladyslaw Konopka ?,10
LOC:city,In what city is the US Declaration of Independence located ?,33
DESC:def,What is the largest variety of cactus ?,3
HUM:ind,Who won the first World Series ?,31
ENTY:cremat,What did Aaron Hass write ?,10
HUM:desc,Who is Samuel Pickering ?,29
HUM:gr,What was the business of the animated Sky Hawks ?,30
HUM:ind,Who was credited with saying : `` I never met a man I did n't like '' ?,31
ENTY:other,What overalls are named for Dungri  a suburb of Bombay ?,18
DESC:reason,Why do rooftops give off steam after a big rainstorm ?,6
LOC:country,What nationality was Jackson Pollock ?,34
NUM:count,How much of the earth 's surface is permanently frozen ?,39
ENTY:other,What is the connection between New Krypton and Daxam ?,18
NUM:date,When was Queen Victoria born ?,40
NUM:count,How many people were executed for Abraham Lincoln 's assassination ?,39
DESC:desc,What must a Las Vegas blackjack dealer do when he reaches 16 ?,4
LOC:other,What is worth seeing in Reims ?,36
ENTY:other,What type of performer is Ileana Cotrubas ?,18
NUM:date,When was Yemen reunified ?,40
ENTY:food,What line of candy products included Super Skrunch and Peanut Butter Oompas ?,14
DESC:reason,Why did the Anglican church split from the Vatican ?,6
HUM:gr,What organization has a Security Council ?,30
DESC:manner,How would I find the price of different organs that have been donated ?,5
HUM:ind,What Mexican leader was shot dead in 1923 ?,31
ABBR:exp,What does NECROSIS mean ?,2
DESC:def,What is magnetar ?,3
ENTY:event,What feud ended with a marriage in Kentucky on March 21  1891 ?,13
ENTY:color,What color is the stripe along each side of a Coho salmon ?,9
NUM:money,What is the federal minimum wage ?,42
ENTY:termeq,Mississippi is nicknamed what ?,26
NUM:other,What are the unemployment statistics for the years 1965 and 1990 ?,44
LOC:other,Where is Santa Lucia ?,36
HUM:ind,What female painter produced primitives of rural New England life ?,31
HUM:ind,What are names of two old men who appear in the serial tv Muppets Show ?,31
ENTY:event,What war saw battles at Parrot 's Beak and Black Virgin ?,13
DESC:desc,What should you yell to hail a taxi in Madrid ?,4
NUM:other,What is the horsepower of the shuttle boosters ?,44
NUM:date,What year did Apartheid start ?,40
HUM:ind,Who created Big Ben ?,31
LOC:city,What city is found in the city of OZ ?,33
DESC:desc,What ever happened to the once popular Yale Lock Company ?,4
HUM:gr,Name the Marvel team loosely based on DC 's Justice League of America ?,30
ENTY:other,What did a 16th-century Aztec athlete get for putting a rubber ball through a ring ?,18
LOC:state,What populous state covers 49  576 square miles ?,37
HUM:gr,What college football team did Knute Rockne build into a power ?,30
LOC:state,In what state was there an 11 million gallon oil spill ?,37
NUM:date,When did Aldous Huxley write  `` Brave New World '' ?,40
LOC:country,What country did the ancient Romans refer to as Hibernia ?,34
HUM:gr,In what high-risk business venture did Jimmy the Greek bet and lose ?,30
ENTY:food,What do chefs call The Master Spice ?,14
ABBR:abb,What is the abbreviation of General Motors ?,1
DESC:def,What is a Devo hat ?,3
NUM:period,How long was the longest hiccup attack ?,46
ENTY:other,What kind of weapons were used in Medieval warfare ?,18
NUM:count,How many people live in Tokyo ?,39
HUM:ind,What fruit-topped actress was known as The Brazilian Bombshell ?,31
ENTY:animal,What are birds descendents of ?,7
HUM:gr,When the Tutankhamun exhibit was on display in the U.S.  what moving company transported it ?,30
ENTY:cremat,Which Kevin Costner movie involves the Sioux Indians ?,10
HUM:ind,Who played the title role in My Favorite Martian ?,31
DESC:manner,How does a scientific calculator work ?,5
ENTY:dismed,What is a fear of fur ?,12
HUM:ind,Who invented the game Scrabble ?,31
ENTY:other,What part of their attire were `` pothooks '' to cowboys of the Old West ?,18
NUM:date,When did humans first begin to write history seriously ?,40
DESC:reason,Why do we have to go to school ?,6
DESC:def,What is Toulmin logic ?,3
ENTY:other,A corgi is a kind of what ?,18
LOC:city,What city in the U.S. experienced the most growth recently ?,33
DESC:def,What is a dangling participle ?,3
LOC:other,What Tokyo street glitters with famed department stores and nightclubs ?,36
NUM:period,What was the average life expectancy during the Stone Age ?,46
HUM:ind,When Mighty Mouse was conceived  what was his original name ?,31
DESC:desc,What is the origin of the peace symbol ?,4
HUM:gr,What group starred in the movie Rock Around the Clock ?,30
NUM:count,How many U.S. presidents were assassinated during Queen Victoria 's reign ?,39
NUM:date,When was the first flush toilet invented ?,40
HUM:ind,What is Nathan Hamill 's role in the new Star Wars prequel ?,31
NUM:count,How many disks does each player have in a four-handed game of Crokinole ?,39
NUM:period,How old is the sun ?,46
NUM:perc,What percentage of children between the ages of two and eleven watch ` The Simpsons ' ?,45
DESC:manner,How can I find a list of  fax and or email  addresses for human resource departments in Massachusetts ?,5
DESC:manner,How do I write to my Congressman ?,5
NUM:count,How many years ago did Led Zeppelin release its last album ?,39
ENTY:termeq,What is the term for a group of geese ?,26
NUM:count,How many people was Randy Craft convicted of killing ?,39
ENTY:event,What was the name of the famous battle between Texas and Mexico ?,13
LOC:country,What country are you in if you woo in the Wu dialect ?,34
ENTY:termeq,What do you call a Poker hand with five cards of the same suit ?,26
HUM:ind,What New York Yankee was known as The Iron Horse ?,31
HUM:ind,Who is considered The First Lady of the American Stage ?,31
HUM:ind,Who penned : `` Neither a borrower nor a lender be '' ?,31
DESC:def,What is moxie ?,3
ENTY:cremat,What was the first Sam Spade novel ?,10
ENTY:cremat,What song did Patti Page set people dancing to in 1950 ?,10
HUM:ind,Who headed Hitler 's infamous Gestapo ?,31
LOC:city,What South American city features the exclusive Copacabana Beach and Ipanema ?,33
LOC:city,What German city do Italians call The Monaco of Bavaria ?,33
LOC:other,What island group contains Jersey  Guernsey  Sark and Herm ?,36
ENTY:dismed,What is a fear of strong light ?,12
HUM:ind,What is a person called that likes fire ?,31
LOC:other,Where was helium first discovered  hence its name ?,36
ENTY:techmeth,What is the best way to overcome a fear ?,25
HUM:gr,Name a South African diamond producer ?,30
HUM:ind,Who made the musical plea Be True to Your School ?,31
HUM:ind,What French designer declared : `` The jean is the destructor ! It is a dictator ! It is destroying creativity. The jean must be stopped ! '' ?,31
NUM:date,What season is the setting for Shakespeare 's Midsummer Night 's Dream ?,40
HUM:gr,Name a band which was famous in the 1960 's .,30
HUM:ind,What comedian was banned from the Ed Sullivan Show for allegedly making an obscene gesture at the show 's host ?,31
LOC:country,What country is the setting for Edgar Allan Poe 's The Pit and the Pendulum ?,34
HUM:ind,What Apollo 11 astronaut minded the store while Armstrong and Aldrin made history ?,31
NUM:money,What is the current ticket fare from from Cairo to Barbados ?,42
LOC:mount,What is the second highest mountain peak in the world ?,35
HUM:ind,What Good Little Witch is Casper 's girlfriend ?,31
ENTY:cremat,In which Tennessee Williams play is one of the characters killed and devoured by a mob of starving children ?,10
HUM:ind,What was the nickname of Frederick I  Holy Roman Emperor and King of Germany ?,31
ENTY:event,What war did the Potsdam Conference follow ?,13
ENTY:dismed,What 's the most common non-contagious disease in the world ?,12
NUM:date,What month  date  and year did Charles I die ?,40
NUM:count,How many cubic feet of space does a gallon of water occupy ?,39
DESC:def,What is the hair style called that new military recruits receive ?,3
LOC:other,What 's the world 's largest cathedral ?,36
DESC:desc,What effects do nitrates have on the environment ?,4
DESC:def,What is Nitrox diving ?,3
LOC:country,What three European countries begin with the letter A ?,34
DESC:desc,What happened in the Long March ?,4
ENTY:event,What was the name of Hitler 's unsuccessful attempt to overthrow the Bavarian government in Munich in 1923 ?,13
DESC:manner,How can I find online spelling ?,5
NUM:count,How many earthworms are in a single pasture ?,39
HUM:ind,Who made Stonehenge ?,31
NUM:other,What is the average hourly rate of American workers ?,44
ENTY:sport,What sport features snatches and clean jerks ?,22
HUM:ind,Who 's the founder and editor of The National Review ?,31
NUM:date,In what year did they build the Berlin Wall ?,40
HUM:ind,Who was the first governor of West Virginia ?,31
LOC:other,What 's the world 's longest suspension bridge ?,36
LOC:city,What Asian city boasts the world 's biggest bowling alley ?,33
NUM:date,When will Jean Aeul publish her next book ?,40
HUM:ind,What famous soldier was born in Europe  died in Asia  and was laid to rest in Africa ?,31
ENTY:food,When it 's time to relax  what one beer stands clear ?,14
HUM:gr,What culture developed the idea of potlatch ?,30
HUM:gr,What baseball team became the Minnesota Twins ?,30
ENTY:instru,What kind of guitar did Jimi Hendrix play ?,15
LOC:city,What were the first three cities to have a population of more than a million ?,33
LOC:other,What constellation contains the twins Castor and Pollux ?,36
NUM:count,How many meters are in a mile ?,39
DESC:def,What is a gas release event ?,3
ENTY:cremat,What James Michener book is subtitled Spanish Travels and Reflections ?,10
LOC:other,What famed London criminal court was once a feudal castle ?,36
NUM:count,How many milligrams are in a gram ?,39
ENTY:other,What stringed weapon fires a bolt ?,18
LOC:other,Where did he get the title ?,36
LOC:other,Where can I find a large list of 5 to 6 letter words ?,36
HUM:ind,What is Michael Jackson 's middle name ?,31
HUM:ind,Who was the first woman to fly solo across the Atlantic ?,31
NUM:period,How long is human gestation ?,46
DESC:def,What does `` Semper Fidelis '' mean ?,3
ENTY:product,What kind of suit did true hepcats wear in 1942 ?,20
LOC:other,Where does Mother Angelica live ?,36
DESC:manner,How can I find out my Moon sign ?,5
DESC:reason,Why does a candle need a wick ?,6
ENTY:instru,Musician Ray Charles plays what instrument ?,15
DESC:desc,What were the three prophecies the witches make to Macbeth ?,4
NUM:other,What 's the population of Mississippi ?,44
HUM:ind,Who started the Dominos Pizza chain ?,31
ENTY:cremat,In what film did Steven Spielberg 's dog star as the main character 's dog ?,10
ENTY:dismed,What are all the different kinds of contraceptives ?,12
NUM:period,How old is Jeremy Piven ?,46
DESC:desc,What is the history of yo-yos ?,4
HUM:ind,Which NBA players had jersey number 0 ?,31
HUM:gr,What chocolate company gives you a one-pound kiss ?,30
DESC:manner,How does one correctly pronounce ` qigong ' ?,5
ENTY:other,What fossilizes to form coprolite ?,18
NUM:count,How many colored squares are there on a Rubik 's Cube ?,39
LOC:other,Where is the Mayo Clinic ?,36
LOC:other,What Caribbean island is sometimes called Little England ?,36
LOC:other,Where is Amsterdam ?,36
LOC:other,Where can I find the lyrics for the song ` Getting Married Today ' from the musical ` Company ' ?,36
ENTY:word,What 's another word that means `` knows all '' ?,28
HUM:ind,Who is the famous movie star who also acted as sewer commissioner of Provo Canyon  Utah ?,31
LOC:city,What Australian city became the home of the America 's Cup ?,33
ENTY:termeq,Aspartame is known by what other name ?,26
DESC:def,What is pasta ?,3
HUM:ind,Name Randy Craft 's lawyer .,31
ENTY:color,What color is `` ash '' ?,9
HUM:gr,What is the best distance education university or college ?,30
LOC:other,What river does the Grand Coulee Dam dam ?,36
NUM:other,How often are quadruplets born ?,44
DESC:manner,How does psorisis disappear ?,5
NUM:count,How many presidents have died on the 4th of July ?,39
ENTY:color,What three colors are on the French flag ?,9
DESC:desc,What 's the mystery of the Bermuda Triangle ?,4
ENTY:other,What are the seven wonders of the world ?,18
ABBR:exp,What does CNN stand for ?,2
HUM:ind,What is a person called that likes fire ?,31
HUM:ind,Who portrayed Vincent Van Gogh in Lust for Life ?,31
ENTY:other,What constitutes an adult ?,18
LOC:other,What is a reliable site that I can download Heretic 2 ?,36
DESC:def,What is a neurosurgeon ?,3
ENTY:sport,What baseball outcome required nine balls in 1879  eight balls in 1880 and seven balls in 1881 ?,22
DESC:def,What are amaretto biscuits ?,3
ENTY:dismed,What common ailment can 't you catch at the North Pole ?,12
NUM:date,What season begins with the vernal equinox ?,40
HUM:ind,Who was known as the Time Master in comic books ?,31
ENTY:animal,What was the name of Roy Rogers 's dog ?,7
ENTY:cremat,What TV series changed the names to protect the innocent ?,10
LOC:other,Where did cable cars first roll down Clay Street in 1873 ?,36
LOC:other,What is George Lucas 's e-mail address ?,36
DESC:manner,How do I give a good massage ?,5
HUM:ind,Who is the father of the computer ?,31
DESC:desc,What is the origin of `` jiggy '' as in getting jiggy with it ?,4
DESC:desc,What is the origin of a.m. and p.m. ?,4
DESC:def,What is the definition of cosmology ?,3
ENTY:animal,What is the name of the dog on the Cracker Jack box ?,7
DESC:def,What are manifest and latent function theories ?,3
ENTY:cremat,What William Styron book is about a black preacher who leads a slave revolt ?,10
ENTY:symbol,What is the chemical symbol for nitrogen ?,24
HUM:ind,Who said : `` Old soldiers never die ; they just fade away '' ?,31
HUM:gr,What National League baseball team employed 72 third baseemen in its first 2 seasons ?,30
DESC:def,What are snowballs to a hot-rodder ?,3
NUM:dist,How long were Tyrannosaurus Rex 's teeth ?,41
DESC:desc,What is the origin of the word Ozymandias ?,4
HUM:ind,Who 's the only man to have won the Olympic decathlon twice ?,31
LOC:city,What Kenyan city is the safari center for East Africa ?,33
DESC:reason,Why do men snore ?,6
DESC:reason,What causes `` rolling thunder '' ?,6
HUM:ind,What is the name of Miss India 1994 ?,31
LOC:state,What four U.S. states have active volcanoes ?,37
DESC:desc,What 's the setting of John Le Carre 's A Small Town in Germany ?,4
DESC:desc,What does an echidna look like ?,4
DESC:desc,What is the secret of the universe ?,4
HUM:ind,Who was the second man to walk on the moon ?,31
HUM:ind,What major Victorian novelist spent as much time working for the post office as he did writing ?,31
DESC:reason,What caused an adjournment of the 25th anniversary session of the United Nations General Assembly ?,6
HUM:gr,The major league baseball team in Pittsburgh is called what ?,30
ENTY:termeq,What is the name of the Islamic counterpart to the Red Cross ?,26
NUM:date,What year were the Olympic Games played in where Nadia Comaneci became popular ?,40
ENTY:substance,What is glass made of ?,23
DESC:manner,How did Lee Harvey Oswald purchase his rifle ?,5
DESC:manner,How do I sing like Elvis Presley ?,5
LOC:other,What are the biggest Indian airports ?,36
ENTY:cremat,What is the folklore story regarding birds ' nests and birds in Christmas trees ?,10
LOC:other,What are the world 's three largest oceans  in order of size ?,36
HUM:ind,Who is the Pope ?,31
LOC:other,Where on the Internet can I find information on laundry detergent ?,36
ENTY:termeq,What do the French call La Manche ?,26
ENTY:techmeth,What 's an easy way to count the approximate number of fish in a lake ?,25
DESC:manner,How do you clean up a cache ?,5
ENTY:veh,What was the name of Aristotle Onassis 's yacht ?,27
ENTY:dismed,What is a fear of being dirty ?,12
ENTY:animal,What animal occurs in Spielberg 's `` Jaws '' ?,7
DESC:def,What 's the Red Planet ?,3
NUM:count,The Shea & Gould law firm had an office in L.A. for how many years ?,39
HUM:ind,What 's the most common surname in America ?,31
NUM:period,How long does it take the typical American to eat 23 quarts of ice cream ?,46
DESC:desc,What is the difference between a fruit and a vegetable ?,4
ENTY:plant,What kind of tree graces Lebanon 's flag ?,19
DESC:def,What is tumbled marble ?,3
ENTY:techmeth,What are the various ways in which one can measure IT User Satisfaction Level ?,25
LOC:city,What city is sometimes called The Athens of Switzerland ?,33
LOC:other,Where did bocci originate ?,36
DESC:manner,How does light travel through the void of space if there is no medium for it to ` wave ' or ` pulse ' .,5
DESC:def,What are the Valdez Principles ?,3
DESC:manner,How can I easily remove red wine stains from t-shirts ?,5
DESC:manner,How do you write MLA style bibliographies for an Internet source ?,5
HUM:desc,Who is Imam Hussain Ben Ali whom Shia people believe in ?,29
DESC:desc,What is the origin of the word assassinate ?,4
LOC:other,Where can I find information about Bob Barr  representative from Georgia ?,36
NUM:other,What is the frequency of VHF ?,44
DESC:desc,What are the Arabic Numerals from 1 to 10 ?,4
ENTY:other,What does the policeman become in the Canadian edition of Monopoly ?,18
NUM:count,How many electoral votes does it take to win presidency ?,39
DESC:def,What is digitalis ?,3
ENTY:plant,What kind of flowers does detective Nero Wolfe raise ?,19
ENTY:substance,What was paper made of in the late 16th century ?,23
HUM:desc,Who was William Henry Harrison ?,29
DESC:desc,What was the outcome of the 1945 Yalta Conference ?,4
DESC:def,What is `` flintknapping '' ?,3
ENTY:color,What 's the most popular contact lens color ?,9
LOC:city,What were the cities of Dickens 's A Tale of Two Cities ?,33
DESC:reason,What causes canker sores in the mouth ?,6
NUM:date,In what year was the movie the Ten Commandments released ?,40
ENTY:animal,What is the fastest fish in the world ?,7
ENTY:color,What color are the castellated walls of the Kremlin ?,9
ENTY:event,What is celebrated during the week of February 21-27 ?,13
ENTY:other,What is damage to business and government caused by bureaucracy ?,18
LOC:country,What countries have the best math students ?,34
NUM:date,When was the De Beers company founded ?,40
ENTY:cremat,What was a California prayer book to an Old West gambler ?,10
HUM:ind,Who was the first black performer to have his own network TV show ?,31
ENTY:termeq,What 's another name for aspartame ?,26
DESC:desc,What did John F. Kennedy consider his greatest blunder in office ?,4
ABBR:abb,What 's the abbreviation for trinitrotoluene ?,1
ENTY:animal,What creature is the absolute fastest in moving in the world  birds  mammals  etc.  ?,7
NUM:date,What is the date of Bastille Day ?,40
ABBR:exp,What is IOC an abbreviation of ?,2
DESC:reason,What 's the proud claim to fame of the young women who formed Kappa Alpha Theta ?,6
ENTY:product,Which two products use a tiger as their symbol ?,20
LOC:other,Where did Freidreich Wilhelm Ludwig Leichhardt  Prussian born explorer  go to school ?,36
ENTY:color,What color eyes are most sensitive to light ?,9
NUM:count,How much folic acid should an expectant mother get daily ?,39
HUM:gr,What company uses the unfamiliar faces of its celebrity spokespeople to promote the use of its product ?,30
ENTY:dismed,What disease does Katharine Hepburn have that makes her voice shake ?,12
DESC:desc,What did FCC chairman Newton Minow declare TV to be on May 9  1961 ?,4
NUM:count,How much caffeine is in a 16 oz cup of coffee ?,39
ENTY:termeq,What is the name of the art of growing miniature trees ?,26
LOC:country,What two countries in South America are landlocked ?,34
DESC:def,What does Tiffany mean ?,3
DESC:reason,Why do magnets attract ?,6
DESC:manner,How do you address a Chinese person ?,5
DESC:def,What is the meaning of thalassemia ?,3
NUM:code,What is Columbia Tristar 's phone number ?,38
DESC:manner,How do I impress a guy ?,5
ENTY:techmeth,What does the method called `` cold fusion '' create ?,25
NUM:date,When did Princess Diana and Prince Charles get married ?,40
ENTY:other,What determines the value of the pearl ?,18
LOC:country,Which country did Hitler rule ?,34
ENTY:veh,What was the name of the American ship sunk by a mine in Havana harbor  causing the Spanish-American war ?,27
HUM:ind,Who directed The Wild Bunch ?,31
ENTY:other,What are emblazoned on the Jolly Roger ?,18
LOC:city,The Orange Bowl is in what city ?,33
DESC:def,What are the alveoli ?,3
HUM:ind,What comedian was born Allen Stewart Konigsberg ?,31
NUM:count,How many Leos have been Pope ?,39
LOC:state,What state was Herbert Hoover born in ?,37
ENTY:cremat,What TV series featured Neal  a martini-drinking St. Bernard ?,10
ENTY:other,What developed a crack in 1835 while tolling the death of U.S. Chief Justice John Marshall ?,18
NUM:count,How many fiddlers did Old King Cole have ?,39
HUM:ind,What poet wrote : `` ... I have promises to keep  and miles to go before I sleep '' ?,31
DESC:def,What is ethylene ?,3
ENTY:cremat,What Irwin Allen bomb has Richard Widmark saying he 'll be `` the first officer in history to get his butt kicked by a mess of bugs ! '' ?,10
ENTY:dismed,What is a fear of clouds ?,12
ENTY:cremat,What is the music used in the new VW Beetle commercial where the car spins and changes colors ?,10
ENTY:dismed,What is a fear of pregnancy ?,12
NUM:count,What is the population in India ?,39
DESC:desc,What is the origin of the word `` pallbearer ? '',4
NUM:period,How long do flies live ?,46
DESC:reason,Why is Microsoft 's Windows 3 software so successful ?,6
