DESC:manner,How can your school march in the Macy 's Thanksgiving Parade ?,5
HUM:ind,What is the real name of disc jockey `` Wolfman Jack '' ?,31
ENTY:veh,What Italian liner was hijacked in 1985 ?,27
LOC:city,What city houses the U.S. headquarters of Procter and Gamble ?,33
ENTY:product,What soap was touted as being `` for people who like people '' ?,20
NUM:money,How much was the minimum wage in 1991 ?,42
ABBR:exp,What does NAFTA stand for ?,2
HUM:ind,Who invented silly putty ?,31
HUM:gr,What new middle school was built in Philadelphia  Pennsylvania last year ?,30
HUM:ind,Who patented the first phonograph ?,31
ENTY:techmeth,What are some tips for building a fire in a fireplace ?,25
ENTY:food,What do manatees eat ?,14
ENTY:termeq,How do you say 2 in Latin ?,26
ENTY:cremat,What were popular songs and types of songs in the 1920s ?,10
NUM:count,How many Vietnamese were there in the Soviet Union ?,39
ENTY:other,What is November 's birthstone ?,18
DESC:def,What is a Certified Nurse Midwife ?,3
NUM:count,On average  how many miles are there to the moon ?,39
HUM:ind,Who created private detective Philip Marlowe ?,31
ENTY:cremat,What Boris Pasternak book sold 5  0 copies to become the fiction best-seller of 1958 ?,10
DESC:desc,What is the origin of the expression `` tout de suite '' ?,4
ENTY:word,What is the longest English word ?,28
DESC:reason,What is the purpose of a car bra ?,6
DESC:reason,What is D.B. Cooper known for ?,6
HUM:desc,Who is Colin Powell ?,29
ENTY:animal,What species is a colt ?,7
ABBR:exp,What is the full name of the PLO ?,2
LOC:country,What is the smallest country in Africa ?,34
HUM:ind,Who coined the term NN cyberspace `` in his novel NN Neuromancer '' ?,31
ENTY:event,What age followed the Bronze Age ?,13
HUM:title,What is her profession ?,32
HUM:ind,What is the full name of the man who invented the multicolored game cube that has 42.3 quintillion potential combinations ?,31
ABBR:exp,What does the word LASER mean ?,2
DESC:def,What does the name `` Anthony '' mean ?,3
HUM:ind,Who was Lauren Bacall 's first husband ?,31
DESC:def,What is a rhomboideus minor ?,3
NUM:count,How many hands does Bjorn Borg use when hitting his forehand ?,39
NUM:count,How many people died on D-Day ?,39
HUM:ind,What U.S. Congressman said : `` Keep the faith  baby '' .,31
HUM:ind,Who created the character of Scrooge ?,31
NUM:other,What is the student population at the University of Massachusetts in Amherst ?,44
LOC:other,Where is Windsor Castle ?,36
NUM:date,When did the Dow first reach ?,40
DESC:reason,Why were people recruited for the Vietnam War ?,6
HUM:gr,What party was Winston Churchill a member of ?,30
HUM:gr,What American League baseball team 's worst finish between 1926 and 1964 was fourth ?,30
LOC:other,Where can I find the names of all the 15 Pokemon ?,36
LOC:state,What state does Martha Stewart live in ?,37
ENTY:animal,Which killer whale died at Sea World of a fungal infection ?,7
LOC:country,What are the Benelux countries ?,34
LOC:other,Where 's the Petrified Forest ?,36
ENTY:lang,What is a language spoken by the Sioux ?,16
LOC:other,Where is Tornado Alley ?,36
HUM:ind,Who was the author of `` John Brown 's Body '' ?,31
HUM:ind,What American poet wrote : `` Good fences make good neighbors '' ?,31
LOC:state,What state in the U.S. has the most blacks ?,37
DESC:reason,Why are electric cars less efficient in the northeast than in California ?,6
HUM:title,What was the occupation of Mandy Rice-Davies ?,32
LOC:city,What is the city in which Maurizio Pellegrin lives called ?,33
HUM:ind,Who painted the Sistine Chapel ?,31
HUM:ind,Name the various costumed personas of Dr. Henry Pym .,31
ENTY:animal,What breed of dog was the `` Little Rascals '' dog ?,7
DESC:desc,What are the living conditions in Cuba ?,4
ENTY:color,What color are school buses ?,9
LOC:other,What is the oldest website on the Internet ?,36
ENTY:event,What events happened January 26  1978 ?,13
HUM:ind,What explorers followed Columbus to the Americas ?,31
HUM:ind,Who is actress Goldie Hawn 's current actor boyfriend ?,31
HUM:ind,Who banned Peter Rose from baseball for betting on games ?,31
DESC:def,What are the seven virtues ?,3
ENTY:termeq,What other name were the `` Little Rascals '' known as ?,26
NUM:date,When was the San Francisco fire ?,40
ENTY:dismed,What is a fear of food ?,12
NUM:count,How many casinos are in Atlantic City  NJ ?,39
NUM:date,What year did the Vietnam War end ?,40
HUM:ind,What are the names of Richard Nixon 's two daughters ?,31
ENTY:word,What 's the word for broken glass or sharp rocks embedded in cement on top of a wall ?,28
NUM:count,What is the chromosome number of an elephant ?,39
HUM:gr,What organization was founded by the Rev. Jerry Falwell ?,30
LOC:other,What 's the longest river in the world ?,36
ENTY:food,Which soft drink does Madonna advertise for ?,14
HUM:gr,What company is being bought by Yahoo and how much is the deal worth ?,30
NUM:date,When was Berlin 's Brandenburg gate erected ?,40
NUM:count,How many double-word-score spaces are there on a Scrabble Crossword Game board ?,39
NUM:date,What year did Germany sign its nonaggression pact with the Soviet Union ?,40
LOC:mount,What mountain range is traversed by the highest railroad in the world ?,35
DESC:reason,Why were the American soldiers in WWI called `` Doughboys '',6
HUM:ind,Who was nicknamed The Little Corporal ?,31
NUM:count,How many CDs has Garth Brooks sold ?,39
ENTY:veh,Name the vessel used by the Atari Force in the DC comics .,27
LOC:other,Where are the leading medical groups specializing in lung diseases ?,36
DESC:manner,How can I find online spelling  and punctuation drills for my 6th grader ?,5
LOC:other,What 's the sacred river of India ?,36
LOC:country,What is Stefan Edberg 's native country ?,34
ENTY:body,What is the only gland in humans that can regenerate itself ?,8
NUM:count,How many Gutenberg Bibles are there ?,39
LOC:country,Name the largest country in South America .,34
ENTY:event,What astronomical phenomenon takes place in Jan. 1999 ?,13
DESC:desc,What information can you get me on Fairground Park in St. Louis,4
HUM:ind,What was American folk hero John Chapman 's nickname ?,31
DESC:desc,What is the difference between a median and a mean ?,4
ENTY:cremat,What was the top box office movie in April 1998 ?,10
DESC:reason,What makes thunder ?,6
HUM:ind,What author did photographer Yousuf Karsh call `` the shiest man I ever met '' ?,31
ENTY:other,Which is the largest clock  diameter wise  in Europe ?,18
ENTY:plant,What plant is rum made from ?,19
LOC:country,What country are Godiva chocolates from ?,34
HUM:ind,Name the poet of the poem which begins : I do not know much about gods ; but I think that the river Is a strong brown god-sullen  and untamed ?,31
ENTY:food,Which condiment was once sold as a patent medicine ?,14
LOC:state,What U.S. state records the least rainfall ?,37
DESC:reason,Why did the world enter a global depression in 1929 ?,6
DESC:def,What was archy  and mehitabel ?,3
LOC:city,What Texas city got its name from the Spanish for `` yellow '' ?,33
ENTY:substance,What are the chemicals used in glowsticks ?,23
LOC:country,What country did the Nile River originate in ?,34
ENTY:color,What color are tennis balls ?,9
HUM:ind,What barroom judge called himself The Law West of the Pecos ?,31
DESC:desc,What excuse did the NATO people give for hitting the Chinese embassy ?,4
HUM:ind,Who was President of Costa Rica in 1994 ?,31
ENTY:sport,What sports event is Meyer Wolfsheim supposed to have fixed in The Great Gatsby ?,22
LOC:country,What country has the best defensive position in the board game Diplomacy ?,34
LOC:country,What two countries share the Khyber Pass ?,34
HUM:ind,Who was chairman of the Senate select committee that tried to get to the bottom of Watergate ?,31
DESC:desc,What is the origin of the surname of Braun ?,4
ENTY:sport,What card game has variations called Canfield  Klondike and Spider ?,22
DESC:def,What is Australia Day ?,3
ENTY:animal,What mammal of North America is the world 's longest-lived for its size ?,7
DESC:def,What was the Chivington Massacre ?,3
HUM:ind,What actor starred in 1980 's Blue Lagoon  1982 's The Pirate Movie and 1983 's A Night in Heaven ?,31
NUM:count,How many home runs did Lou Gehrig have during his career ?,39
LOC:city,In what city is the headquarters of Sinn Fein ?,33
LOC:other,Where can I find information on George Bush ?,36
HUM:ind,Who is the voice of Miss Piggy ?,31
ENTY:termeq,What is the dialogue circle in cartoons called ?,26
DESC:def,What does the word camaro mean  from the GM car the Camaro ?,3
HUM:ind,Who replaced Bert Parks as the host of The Miss America Pageant ?,31
NUM:count,How many boys play the game in Winslow Homer 's 1872 painting Snap the Whip ?,39
DESC:def,What is the AIM-54C Phoenix ?,3
NUM:date,When are sheep shorn ?,40
ENTY:sport,What sport is Chris Jogis a top player of ?,22
LOC:other,What 's the second-largest island in the world ?,36
DESC:def,What is the definition of low island ?,3
NUM:date,What century does Captain Video live in ?,40
ENTY:other,What types of water pollution are there ?,18
NUM:count,How many astronauts manned each Project Mercury flight ?,39
ENTY:food,What soft drink would provide me with the biggest intake of caffeine ?,14
ENTY:other,What 's the name of a golf course in Myrtle Beach ?,18
ENTY:event,What are some of the significant historical events of the 1990s ?,13
ENTY:cremat,Name the only extant trilogy of classical Greek plays .,10
LOC:other,Where is Logan Airport ?,36
DESC:desc,What is the difference between Neoclassical art and Romanticism art ?,4
HUM:ind,Who was the first person inducted into the U.S. Swimming Hall of Fame ?,31
HUM:ind,What golfer has been called Ohio Fats and Blobbo ?,31
HUM:ind,Who murdered Leno and Rosemary LaBianca on August 1,31
NUM:money,What is the average cost for four years of medical school ?,42
ENTY:other,What does God create in the first sentence of the Bible ?,18
HUM:ind,Which of the following men was not married to Rita Hayworth ?,31
NUM:money,What is the current ticket fare from from Cairo to Barbados ?,42
ABBR:exp,What does NN O `` mean when used as a prefix in Irish surnames ?,2
DESC:manner,How do you find oxidation numbers ?,5
LOC:state,What is the state nickname of Mississippi ?,37
DESC:reason,What is Black Hills  South Dakota most famous for ?,6
ENTY:cremat,What 1966 boob tube bomb took astronauts back to prehistoric times ?,10
NUM:count,How many students attend the University of Massachusetts ?,39
HUM:ind,Who said  `` I shall return . '' during World War Two ?,31
ENTY:event,What holidays are celebrated in Ireland ?,13
HUM:ind,Who portrayed Etta Place  companion to Butch Cassidey and the Sundance Kid ?,31
DESC:def,What are the Greek numerals ?,3
LOC:other,What 's the name of the temple that is located near the capital city of Laos ?,36
ENTY:dismed,What is a fear of sleep ?,12
ENTY:sport,What auto race was Wilbur Reed the first to win three times ?,22
ENTY:animal,What are the most common breeding birds in the U.S. ?,7
ENTY:event,What was organized as a Confederate veterans ' social club in Pulaski  in Tennessee  in 1866 ?,13
DESC:manner,How do you look up criminal records on the Internet ?,5
LOC:other,Where is the actress  Marion Davies  buried ?,36
DESC:desc,What is an example of an actual case of using the Fourteenth Amendment ?,4
HUM:ind,Who was the Charlie perfume woman ?,31
HUM:ind,Who portrayed `` Rosanne Rosanna-Dana '' on the television show `` Saturday Night Live '' ?,31
HUM:ind,What singer became despondent over the death of Freddie Prinze  quit show business  and then quit the business ?,31
NUM:date,When did Iraqi troops invade Kuwait ?,40
ENTY:termeq,What was Mark Johnson referring to when he said : `` I still can 't believe it- we beat the Russians ? '',26
ENTY:product,What car was driven in the 199 release of `` Smokey and the Bandit '' ?,20
HUM:gr,What was the backup singing group for Roy Rogers ?,30
HUM:ind,What famous singing cowboy owns the California Angels baseball team ?,31
ENTY:cremat,What 1915 film was the first to gross $5 million ?,10
DESC:desc,Where did the term `` 86 '' come from ?,4
DESC:reason,What causes someone to be ticklish ?,6
NUM:perc,What is the probability that at least 2 out of 25 people will have the same birthday ?,45
NUM:count,How many Canadians emmigrate each year ?,39
DESC:reason,Why did several San Diego schools remove apples from students menus ?,6
ENTY:instru,What musical instrument did Sherlock Holmes play ?,15
HUM:ind,Who was Gerald Ford 's vice president ?,31
DESC:def,What is `` the washed vodka '' ?,3
NUM:count,How many different languages are spoken in Europe ?,39
NUM:date,What year was Desmond Mpilo Tutu awarded the Nobel Peace Prize ?,40
ENTY:termeq,What 's a `` Drinker respirator '' better known as ?,26
HUM:ind,Who invented batteries ?,31
DESC:reason,Why do recipe books recommend starting with cold water when you boil something ?,6
LOC:other,Where can I buy a good snowboard for less than $200 ?,36
HUM:title,What title did Suzette Charles assume for two months in 1984 ?,32
HUM:ind,What was the infamous pseudonym of Peter Sutcliffe ?,31
ENTY:animal,What is Smokey The Bear 's middle name ?,7
HUM:title,What is Nicholas Cage 's occupation ?,32
ENTY:cremat,What British TV series featured Emma Peel ?,10
LOC:other,What London street is the home of British journalism ?,36
ENTY:event,What tragedy befell the city of Dogtown in 1899 ?,13
DESC:def,What is the Immaculate Conception ?,3
ENTY:veh,What are the names of all the U.S. Navy aircraft carriers ?,27
ENTY:other,What format was VHS 's main competition ?,18
DESC:def,What is Candlemas Day ?,3
LOC:city,In what city is the famed St. Mark 's Square ?,33
ENTY:termeq,What does the Ouarterly Review of Doublespeak call an `` inoperative statement '' ?,26
NUM:money,How much did the minimum wage amount to in 1991 ?,42
LOC:other,Where is Tufts University ?,36
DESC:def,What is a pyrotechnic display ?,3
DESC:manner,How do I find out about jobs ?,5
HUM:gr,What Japanese manufacturer is known for both its pianos and its motorcycles ?,30
NUM:other,What is the chemical reactivity of argon ?,44
NUM:count,How many engines does a Boeing 737 have ?,39
DESC:desc,What is the origin of the term `` The Brooklyn Side '' in bowling ?,4
ENTY:dismed,What is a fear of being cold ?,12
NUM:dist,How long was Mao 's 1930s Long March ?,41
ENTY:sport,What net game sees its women 's world amateur champions receive the Uber Cup ?,22
ENTY:animal,What four-legged creature did a Cornell University study say would make man 's best companion in space ?,7
NUM:weight,What does a teaspoon of matter weigh in a black hole ?,0
ENTY:other,What did British companies stick 175  0 tons of tea into in 1982 ?,18
LOC:state,What province is Edmonton located in ?,37
DESC:manner,How can I find out how much income tax is paid on Social Security income on the 1998 income tax ?,5
HUM:ind,Who did Sonny Liston succeed as world heavyweight boxing champion ?,31
ENTY:animal,What is California 's state bird ?,7
NUM:date,What is Martin Luther King Jr. 's real birthday ?,40
HUM:gr,Name the various super-teams to which the Angel has belonged .,30
DESC:manner,How does Zatanna perform her magic in DC comics ?,5
ENTY:veh,What 's the name of Jacques Cousteau 's research ship ?,27
HUM:ind,What President dispatched a cruiser to carry Charles Lindbergh home after his epic flight ?,31
HUM:ind,Whose video is titled Shape Up with Arnold ?,31
ENTY:cremat,In which Kevin Costner movie did Sioux Indians play a role ?,10
NUM:count,How many James Bond novels are there ?,39
DESC:manner,How do you get dates with the `` Hooters '' girls ?,5
ENTY:animal,What bird can swim but can 't fly ?,7
DESC:manner,How can I get a comic character I made copyrighted and published ?,5
NUM:volsize,How large is the Arctic refuge to preserve unique wildlife and wilderness value on Alaska 's north coast ?,49
DESC:def,What is Plc ?,3
NUM:count,How much electricity does the brain need to work ?,39
NUM:count,How many acres in a mile ?,39
ENTY:cremat,What Dickens novel has David carrying the message `` Barkis is willin '' to Peggy ?,10
DESC:def,What is a hyperlink ?,3
HUM:ind,Who 's the twin brother of the Greek goddess Artemis ?,31
DESC:desc,Where did marijuana come from ?,4
NUM:money,What is the per-capita income of Colombia  South America  ?,42
ENTY:cremat,What novel has Big Brother watching ?,10
NUM:count,How many Grammys did Michael Jackson win in 1983 ?,39
DESC:def,What does Elysium mean ?,3
LOC:other,What is the oldest website on the Internet ?,36
DESC:def,What is Shalom ?,3
ENTY:sport,What was the favorite sport of Tom Wolfe 's The Pump House Gang ?,22
ENTY:substance,What organic fuel do bog-dwellers use a `` slane '' to cut ?,23
NUM:period,What is the average age of a member of the team that worked on the Manhatten Project ?,46
LOC:country,What country received all the Nobel Prizes awarded in 1976 ?,34
DESC:manner,How do you get rid on woodpeckers ?,5
NUM:count,How many syllables are there in a line of hendecasyllabic poetry ?,39
ENTY:food,What soft drink first appeared in the Old Corner Drug Store in Waco  Texas  in 1885 ?,14
LOC:other,What is Britain 's possession on the Chinese mainland ?,36
HUM:ind,Who was America 's first Public Enemy No. 1 ?,31
NUM:count,How many children under 18 are victims of some sort of Physical Abuse each year ?,39
DESC:desc,What is the origin of thank you notes ?,4
ENTY:other,What did Jimmy Stewart invent ?,18
ENTY:other,What generation am I in ?,18
ENTY:dismed,What is a fear of hell ?,12
HUM:desc,Who is Dear Abby ?,29
HUM:ind,Who lives at 24 Sussex Drive  Ottawa ?,31
ENTY:substance,What is Jell-O made from ?,23
HUM:desc,Who was Monet ?,29
LOC:state,What are the only two states that incorporate the Confederate battle flag in their flags ?,37
DESC:manner,How do you make panoramic sugar eggs for Easter - the ones with the scene inside ?,5
ENTY:food,What 's the Southern dish made of pigs ' small intestines ?,14
LOC:other,Where is Guam ?,36
HUM:ind,Who was the famous door-to-door brush salesman ?,31
DESC:def,What is the executor in a will ?,3
HUM:gr,What inescapable purveyor of background music celebrated its 5th anniversary in July  1984 ?,30
NUM:count,How many people in America snore ?,39
HUM:ind,Who is always trying to get the rent from Andy Capp ?,31
ENTY:food,What soft drink is most heavily caffeinated ?,14
HUM:ind,Who did Jackie Kennedy commission to write The Death of a President ?,31
ENTY:dismed,Which drug is commonly used to treat AIDS ?,12
NUM:count,How many stars are there on the Soviet Union 's flag ?,39
DESC:desc,What is the difference between microprocessors & microcontrollers ?,4
HUM:ind,Who sought to create The Great Society ?,31
LOC:other,What are tourist attractions in Reims ?,36
NUM:dist,What are the lengths of pearl necklaces ?,41
HUM:ind,Who said : `` Soldiers win the battles and generals get the credit '' ?,31
DESC:desc,What is the proof that houseplants metabolize carcinogens ?,4
DESC:reason,What prompted the co-pilot of the Enola Gay to enter only `` My God '' in his log ?,6
NUM:period,How long does it take the typical hen to lay 19 dozen eggs ?,46
LOC:city,What Colorado city owns its own glacier ?,33
DESC:desc,What is the history of `` the toast '' ?,4
ENTY:event,What was the name of the Protestant revolt against the supremacy of the Pope ?,13
DESC:def,What is an arab strap ?,3
NUM:money,How much does it cost  average or whatever is available  to produce and send junk mail catalogues in the US ?  DT CD NN NN ,42
HUM:ind,Who is the current UN Secretary General ?,31
HUM:gr,Who provides telephone service in Orange County  California ?,30
LOC:other,Where did guinea pigs originate ?,36
LOC:country,What two countries ' coastlines border the Bay of Biscay ?,34
DESC:reason,Why did Egyptians shave their eyebrows ?,6
HUM:gr,What organization did Mr. Waverly assign agents for ?,30
NUM:date,When was the slinky invented ?,40
HUM:ind,What are the characters ' names in the Scooby-Doo cartoon ?,31
ENTY:dismed,What is a fear of cold ?,12
HUM:title,What was Eduard Shevardnadze 's job in the Soviet Union ?,32
DESC:reason,What causes rust ?,6
HUM:ind,Which is the only Dick Tracy villain to appear three times ?,31
ENTY:animal,What was the monster in Spielberg 's film `` Jaws '' ?,7
ENTY:color,What color is an Arctic fox in winter ?,9
DESC:def,What do the names Neil  Mary  and Anthony mean ?,3
LOC:city,What European capital celebrated its 2  000th anniversary in 1951 ?,33
DESC:reason,Why do people in the upper peninsula of Michagin say `` eh ? '' ?,6
ENTY:plant,What flower did Vincent Van Gogh paint ?,19
LOC:country,What country was the setting of You Only Live Twice ?,34
NUM:perc,What was Thatcher 's approval rating after 10 years in power ?,45
ENTY:animal,Winnie the Pooh is what kind of animal ?,7
DESC:desc,What was the first Funk 'N Lata  Brazilian group  success ?,4
DESC:def,What is a handheld PC ?,3
DESC:desc,What did John Hinckley do to impress Jodie Foster ?,4
HUM:title,What is Larry King 's job ?,32
NUM:count,How many calories are in a tomato ?,39
LOC:state,In what state was the first co-educational college established,37
ENTY:event,What war saw a naval battle between the luxury liners Cap Trafalgar and the Carmania ?,13
ENTY:techmeth,What is the treatment for depression ?,25
ENTY:dismed,What is a fear of slime ?,12
LOC:country,What country in Latin America is the largest one ?,34
LOC:other,On which Hawaiian island is Pearl Harbor ?,36
HUM:ind,What feathered cartoon characters do Yugoslavians know as Vlaja  Gaja  and Raja ?,31
ENTY:cremat,What Marx Brothers movie centers on a stolen painting ?,10
DESC:desc,What was unusual about Alexandra 's appearance in Josie and the Pussycats ?,4
DESC:desc,What is the origin of the word `` mind '' ?,4
NUM:date,When was Dick Clark born ?,40
ENTY:sport,What game is fatal to anybody over 21 ?,22
NUM:other,What is the death toll of people dying from tuberculosis ?,44
DESC:desc,What happened to Moon Maiden ?,4
LOC:city,What city is wiener schnitzel named for ?,33
DESC:def,What are the Urals ?,3
DESC:manner,How can you stop the itch from poison ivy ?,5
LOC:other,What desert has the highest sand dunes ?,36
LOC:country,What two countries contain Sierra Nevada mountains ?,34
DESC:manner,How do you tell your parents you are dating an older man ?,5
NUM:period,How long was the TV mission of Star Trek 's Enterprise to be ?,46
NUM:code,What phone number can I call to have a tree planted ?,38
NUM:date,When did the `` Star-Spangled Banner '' become the national anthem ?,40
HUM:desc,Who was Lacan ?,29
ENTY:techmeth,What are the four natural aids used in riding a horse ?,25
LOC:other,What continent 's name appears on the upper left corner of a Budweiser label ?,36
HUM:ind,Who was the Secretary of War in the Civil War during the Battle of Gettysburg ?,31
HUM:ind,Who did Bobby Fischer beat to win the world chess championship ?,31
DESC:manner,How do you exterminate bees that are in the walls of your home ? Will bee eggs remain over winter ?,5
LOC:other,Where can I get information and statistics on countries and nations ?,36
ENTY:lang,Name a Gaelic language .,16
NUM:date,What day is August 13  1971 ?,40
LOC:other,Where can I find a list of all the companies in America that offer a direct stock purchase plan ?,36
DESC:manner,How do you send a movie transcript to Hollywood so that it can be produced into a film ?,5
ENTY:cremat,What literary classic centers on the search for a treasure in gold worth 7  0 pounds ?,10
DESC:desc,What is the origin of blue for boys and pink for girls ?,4
ENTY:cremat,What is the name of the Michelangelo painting that shows two hands with fingers touching ?,10
NUM:volsize,How big is a quart ?,49
DESC:def,What is the Hub of London ?,3
ENTY:cremat,Jude Law acted in which film ?,10
DESC:reason,What causes panic attacks ?,6
DESC:def,What was the filling in the first golf balls ?,3
ENTY:dismed,What drug did Sigmund Freud become fascinated with while experimenting with the treatment of neurasthenia ?,12
LOC:country,What country was A Terrible Beauty to Leon Uris ?,34
DESC:def,What is typhoid fever ?,3
LOC:other,Where can I buy a hat like the kind Jay Kay from Jamiroquai wears ?,36
DESC:def,What are the Twin Cities ?,3
ENTY:cremat,What is Beethoven 's 9th symphony called ?,10
HUM:ind,Name the lawyer for Randy Craft .,31
ENTY:food,Which breakfast cereal brought you `` the best each morning '' ?,14
ABBR:exp,What does Ms.  Miss  and Mrs. stand for ?,2
LOC:other,What is the Homelite Inc. home page ?,36
ENTY:substance,What explosive do you get by mixing charcoal  sulfur and saltpeter ?,23
LOC:other,What mountainous region of the world is the Lhasa Apso dog native to ?,36
ENTY:dismed,What cancer is commonly associated with AIDS ?,12
NUM:period,How long does it take light to reach the Earth from the Sun ?,46
HUM:ind,Who lives at 39 Stone Canyon Way ?,31
NUM:count,How many questions are on this thing ?,39
HUM:ind,Who played Humpty Dumpty in the 1933 film Alice in Wonderland ?,31
HUM:ind,Who is Karenna Gore  Al Gore 's oldest daughter  married to ?,31
HUM:ind,Who played the title role in I Was a Teenage Werewolf ?,31
DESC:reason,Why are there olives in martinis ?,6
NUM:date,In what year did Hitler gain power of Germany ?,40
NUM:date,What year did Rossetti paint `` Beata Beatrix '' ?,40
HUM:gr,What record company produced the 1978 movie The Wiz ?,30
LOC:other,Where can I find information about touring the Philippines ?,36
ENTY:other,What did The Gas House Gang play ?,18
NUM:count,How many square feet is Bill Gates ' home ?,39
HUM:ind,What is the name of actor Rex Harrison 's son  who starred in a modestly popular TV show during the late 1960's ?,31
DESC:def,What is the highest Roman numeral ?,3
ENTY:other,What 's the most popular form of bridge ?,18
HUM:ind,Who was the inventor of the stove ?,31
HUM:ind,What comedian has a legendary reputation for stealing jokes ?,31
LOC:other,Where can I find information on the cyclone that hit New Jersey on 8/28/1941 ?,36
